<?xml version="1.0" encoding="utf-8"?>

<!DOCTYPE table-panel SYSTEM "sierra.dtd">

<table-panel columnCount="4" padding="8" opaque="true">
    <button text="One"/>
    <button text="Two"/>
    <button text="Three"/>
    <button text="Four"/>

    <button text="Five" columnSpan="2"/>
    <button text="Six"/>
    <button text="Seven"/>

    <button text="Eight"/>
    <button text="Nine" columnSpan="3"/>

    <button text="Ten" columnSpan="4"/>
</table-panel>
