<?xml version="1.0" encoding="utf-8"?>

<!DOCTYPE table-panel SYSTEM "sierra.dtd">

<table-panel columnCount="4" alignToBaseline="true" padding="8" opaque="true">
    <row-panel alignToBaseline="true" spacing="4" border="#c0c0c0" padding="4" columnSpan="3">
        <label text="abcdefg" font="small" border="#c0c0c0"/>
        <label text="hijk" font="large" border="#c0c0c0"/>

        <spacer size="20, 20" border="#c0c0c0"/>

        <column-panel spacing="4" border="#c0c0c0, 1, dotted" padding="8">
            <label text="abcdefg" font="medium" border="#c0c0c0"/>
            <label text="hijk" font="small" border="#c0c0c0"/>
        </column-panel>

        <row-panel alignToBaseline="true" spacing="4" border="#c0c0c0, 1, dotted" padding="8">
            <label text="abcd" font="large" border="#c0c0c0"/>
            <label text="efg" font="medium" border="#c0c0c0"/>
            <label text="hijk" font="small" border="#c0c0c0"/>
        </row-panel>
    </row-panel>

    <label text="lmnop" font="medium" border="#c0c0c0"/>

    <label text="abcd" font="medium" border="#c0c0c0"/>
    <label text="efg" font="small" border="#c0c0c0"/>
    <label text="hijk" font="medium" border="#c0c0c0"/>
    <label text="lmnop" font="small" border="#c0c0c0"/>
</table-panel>
