<?xml version="1.0" encoding="utf-8"?>

<!DOCTYPE scroll-pane SYSTEM "sierra.dtd">

<scroll-pane padding="0">
    <column-panel spacing="8" padding="8" scrollableTracksViewportWidth="true" opaque="true" background="#ffffff">
        <column-panel spacing="4">
            <text-pane text="Heading 1" font="h1.font"/>
            <text-pane text="Lorem ipsum dolor sit amet, consectetur adipiscing elit, sed do eiusmod tempor incididunt ut labore et dolore magna aliqua."/>

            <row-panel>
                <form-panel>
                    <validated-text-field label="Field 1" columns="12" pattern="[a-zA-Z]*"/>
                    <validated-text-field label="Field 2" columns="12" pattern="[0-9]*"/>

                    <check-box text="Check box"/>

                    <button name="submitButton" text="Submit"/>
                </form-panel>
            </row-panel>
        </column-panel>

        <column-panel spacing="4">
            <text-pane text="Heading 2a" font="h2.font"/>
            <text-pane text="Ut enim ad minim veniam, quis nostrud exercitation ullamco laboris nisi ut aliquip ex ea commodo consequat."/>

            <row-panel>
                <spacer weight="1"/>
                <image-pane image="world.png" scaleMode="fill-height" size="120"/>
                <spacer weight="1"/>
            </row-panel>
        </column-panel>

        <column-panel spacing="4">
            <text-pane text="Heading 2b" font="h2.font"/>
            <text-pane text="Duis aute irure dolor in reprehenderit in voluptate velit esse cillum dolore eu fugiat nulla pariatur."/>

            <column-panel padding="0, 8, 0, 0">
                <row-panel spacing="4">
                    <text-pane text="•"/>
                    <text-pane text="Excepteur sint occaecat cupidatat non proident" weight="1"/>
                </row-panel>
                <row-panel spacing="4">
                    <text-pane text="•"/>
                    <text-pane text="Sunt in culpa qui officia deserunt" weight="1"/>
                </row-panel>
                <row-panel spacing="4">
                    <text-pane text="•"/>
                    <text-pane text="Mollit anim id est laborum" weight="1"/>
                </row-panel>
            </column-panel>
        </column-panel>
    </column-panel>
</scroll-pane>
