<?xml version="1.0" encoding="utf-8"?>

<!DOCTYPE stack-panel SYSTEM "sierra.dtd">

<stack-panel padding="8" opaque="true">
    <column-panel>
        <spacer weight="1"/>

        <row-panel>
            <spacer weight="1"/>
            <button text="Press Me"/>
            <spacer weight="1"/>
        </row-panel>

        <spacer weight="1"/>
    </column-panel>

    <column-panel spacing="8">
        <text-pane text="Lorem ipsum dolor sit amet, consectetur adipiscing elit, sed do eiusmod tempor incididunt ut labore et dolore magna aliqua."
            horizontalAlignment="center"
            verticalAlignment="top"
            border="#c0c0c0, 1, dotted, 8" padding="4"
            weight="1"/>

        <text-pane text="Ut enim ad minim veniam, quis nostrud exercitation ullamco laboris nisi ut aliquip ex ea commodo consequat."
            horizontalAlignment="center"
            verticalAlignment="center"
            border="#c0c0c0, 1, dotted, 8" padding="4"/>

        <text-pane text="Duis aute irure dolor in reprehenderit in voluptate velit esse cillum dolore eu fugiat nulla pariatur."
            horizontalAlignment="center"
            verticalAlignment="center"
            border="#c0c0c0, 1, dotted, 8" padding="4"/>

        <text-pane text="Excepteur sint occaecat cupidatat non proident, sunt in culpa qui officia deserunt mollit anim id est laborum."
            horizontalAlignment="center"
            verticalAlignment="bottom"
            border="#c0c0c0, 1, dotted, 8" padding="4"
            weight="1"/>
    </column-panel>
</stack-panel>
