<?xml version="1.0" encoding="utf-8"?>

<!DOCTYPE column-panel SYSTEM "sierra.dtd">

<column-panel spacing="8" padding="8" opaque="true">
    <row-panel spacing="8">
        <row-panel spacing="4">
            <label text="ticker"/>
            <text-field name="tickerTextField" columns="6"/>
        </row-panel>

        <row-panel spacing="4">
            <label text="count"/>
            <spinner name="countSpinner"/>
        </row-panel>

        <activity-indicator name="activityIndicator"/>

        <spacer weight="1"/>

        <button name="submitButton" text="submit"/>
    </row-panel>

    <separator/>

    <row-panel spacing="8" weight="1">
        <column-panel spacing="4">
            <form-panel>
                <text-field name="nameTextField" label="name" columns="16" editable="false"/>
                <text-field name="exchangeCodeTextField" label="exchangeCode" columns="6" editable="false"/>
                <text-field name="startDateTextField" label="startDate" columns="12" editable="false"/>
                <text-field name="endDateTextField" label="endDate" columns="12" editable="false"/>
            </form-panel>

            <separator/>

            <scroll-pane weight="1">
                <text-area name="descriptionTextArea" editable="false" lineWrap="true" wrapStyleWord="true"/>
            </scroll-pane>
        </column-panel>

        <separator orientation="vertical"/>

        <tabbed-pane style="showContentSeparator: false" weight="1">
            <scroll-pane tabTitle="table">
                <table name="historicalPricingTable" rowSelectionMode="single-selection"/>
            </scroll-pane>

            <chart-pane name="historicalPricingChartPane" tabTitle="chart" padding="8"
                opaque="true" background="TextArea.background"
                border="Component.borderColor"/>
        </tabbed-pane>
    </row-panel>
</column-panel>
