<?xml version="1.0" encoding="UTF-8"?>

<!DOCTYPE column-panel SYSTEM "sierra.dtd">

<column-panel>
    <menu-bar name="menuBar">
        <menu text="File">
            <menu-item name="openItem" text="Open..."/>
            <menu name="recentMenu" text="Recent"/>
            <popup-menu-separator/>
            <menu-item name="saveItem" text="Save"/>
            <popup-menu-separator/>
            <menu-item name="exitItem" text="Exit"/>
        </menu>
        <menu text="Search">
            <menu-item name="findItem" text="Find" accelerator="VK_F"/>
            <menu-item name="replaceItem" text="Replace" accelerator="VK_R"/>
            <menu-item name="gotoLineItem" text="Go To Line" accelerator="VK_G"/>
        </menu>
        <menu text="About">
            <menu-item name="aboutItem" text="About Previewer"/>
        </menu>
    </menu-bar>

    <split-pane name="splitPane" resizeWeight="0.5" weight="1">
        <label text="Code editor will replace this at runtime"/>
        <column-panel name="previewPanel" padding="5, 5, 5, 5"/>
    </split-pane>

    <label name="filePathLabel" text="" padding="4, 6, 4, 6"/>
    <label name="statusBar" text="Ready." padding="2, 5, 2, 5" border="#c0c0c0, 1"/>
</column-panel>