<?xml version="1.0" encoding="utf-8"?>

<!DOCTYPE column-panel SYSTEM "sierra.dtd">

<column-panel spacing="8" padding="8" opaque="true">
    <column-panel>
        <check-box text="Check box 1"/>
        <check-box text="Check box 2"/>
    </column-panel>

    <row-panel spacing="8">
        <button name="button" text="Execute Task"/>
        <label name="label" foreground="#808080"/>
        <spacer weight="1"/>
        <activity-indicator name="activityIndicator"/>
    </row-panel>
</column-panel>
